{"apiVersion":"nexa.dev/frontend-locale/v1","kind":"FrontendLocale","locale":"en-US","messages":{"core.accounts.accountId":"Account ID","core.accounts.displayName":"Display name","core.accounts.email":"Email","core.accounts.newPassword":"New password","core.accounts.resetConfirm":"Reset this account password?","core.accounts.resetPassword":"Reset password","core.accounts.sourceCode":"Source","core.accounts.title":"Accounts","core.accounts.username":"Username","core.actions.create":"Create","core.actions.update":"Update","core.actions.updateStatus":"Update status","core.common.code":"Code","core.common.keyword":"Keyword","core.common.name":"Name","core.common.status":"Status","core.common.version":"Version","core.members.memberId":"Member ID","core.members.replaceRoles":"Replace roles","core.members.roles":"Roles","core.members.title":"Members","core.menus.component":"Component","core.menus.icon":"Icon","core.menus.menuId":"Menu ID","core.menus.parentCode":"Parent code","core.menus.path":"Path","core.menus.sortOrder":"Order","core.menus.title":"Menus","core.permissions.description":"Description","core.permissions.permissionId":"Permission ID","core.permissions.resourceCode":"Resource code","core.permissions.title":"Permissions","core.roles.managed":"Managed","core.roles.menuCodes":"Menu codes","core.roles.menus":"Menus","core.roles.permissionCodes":"Permission codes","core.roles.permissions":"Permissions","core.roles.replaceMenus":"Replace menus","core.roles.replacePermissions":"Replace permissions","core.roles.roleId":"Role ID","core.roles.title":"Roles","core.status.disabled":"Disabled","core.status.enabled":"Enabled","core.tenants.initialAdmin":"Initial administrator","core.tenants.provision":"Provision tenant","core.tenants.tenantId":"Tenant ID","core.tenants.title":"Tenants"}}
