{"apiVersion":"nexa.dev/frontend-locale/v1","kind":"FrontendLocale","locale":"zh-CN","messages":{"quality.requirement.evidenceRefs":"证据引用","quality.requirement.freezeRefs":"冻结引用","quality.requirement.freezeStatus":"冻结状态","quality.requirement.gapCodes":"差距编码","quality.requirement.requirement":"要求","quality.requirement.status":"状态","quality.requirement.testRefs":"测试引用","quality.requirement.title":"标题","quality.snapshot.apiVersion":"API 版本","quality.snapshot.kind":"类型","quality.snapshot.readModelScope":"只读模型范围","quality.snapshot.requirements":"要求清单","quality.snapshot.revision":"修订版本","quality.snapshot.sourceProfile":"来源配置","quality.snapshot.title":"质量快照"}}
