{
  "apiVersion": "nexa.dev/frontend-locale/v1",
  "kind": "FrontendLocale",
  "locale": "en-US",
  "messages": {
    "quality.readModel.title": "Requirement coverage",
    "quality.readModel.sourceProfile": "Source profile",
    "quality.readModel.readModelScope": "Read model scope",
    "quality.readModel.revision": "Revision",
    "quality.readModel.requirements": "Requirements",
    "quality.readModel.requirement": "Requirement",
    "quality.readModel.requirementTitle": "Title",
    "quality.readModel.status": "Status",
    "quality.readModel.testRefs": "Tests",
    "quality.readModel.evidenceRefs": "Evidence",
    "quality.readModel.freezeRefs": "Freeze records",
    "quality.readModel.freezeStatus": "Freeze status",
    "quality.readModel.gapCodes": "Gaps"
  }
}
