{"apiVersion":"nexa.dev/frontend-locale/v1","kind":"FrontendLocale","locale":"zh-CN","messages":{"core.accounts.accountId":"账号 ID","core.accounts.displayName":"显示名称","core.accounts.email":"邮箱","core.accounts.newPassword":"新密码","core.accounts.resetConfirm":"确认重置该账号密码？","core.accounts.resetPassword":"重置密码","core.accounts.sourceCode":"来源","core.accounts.title":"账号管理","core.accounts.username":"用户名","core.actions.create":"创建","core.actions.update":"更新","core.actions.updateStatus":"更新状态","core.common.code":"编码","core.common.keyword":"关键词","core.common.name":"名称","core.common.status":"状态","core.common.version":"版本","core.members.memberId":"成员 ID","core.members.replaceRoles":"替换角色","core.members.roles":"角色","core.members.title":"成员管理","core.menus.component":"组件","core.menus.icon":"图标","core.menus.menuId":"菜单 ID","core.menus.parentCode":"父级编码","core.menus.path":"路径","core.menus.sortOrder":"排序","core.menus.title":"菜单资源","core.permissions.description":"说明","core.permissions.permissionId":"权限 ID","core.permissions.resourceCode":"资源编码","core.permissions.title":"权限资源","core.roles.managed":"受管角色","core.roles.menuCodes":"菜单编码","core.roles.menus":"菜单","core.roles.permissionCodes":"权限编码","core.roles.permissions":"权限","core.roles.replaceMenus":"替换菜单","core.roles.replacePermissions":"替换权限","core.roles.roleId":"角色 ID","core.roles.title":"角色管理","core.status.disabled":"已禁用","core.status.enabled":"已启用","core.tenants.initialAdmin":"初始管理员","core.tenants.provision":"开通租户","core.tenants.tenantId":"租户 ID","core.tenants.title":"租户管理"}}
